,Date,Messages
705,2021-05-08,where to buy shiba 
706,2021-05-08,"crypto.com app, but do not buy now. shiba is dumping "
707,2021-05-08,"I am losing profit, i need to be able to sell my shiba as soon as possible!!!! "
708,2021-05-08,because everyone is selling their doge. that is why all exchanger are overwhelmer 
709,2021-05-08,you all do this every time dogecoin pump ... you all fake shutdown the app why? is it a money issue 
710,2021-05-08,doge is dumping actually 
711,2021-05-08,I am sool pissed shiba dipping are not i cannot log in 
712,2021-05-08,dogecoin go up to the moon and we have the probe with the app oe shit man loa 
713,2021-05-08,anyone got shiba? 
714,2021-05-08,guts do not worry. everyone was trying to buy shiba and the app could not handle it. now everyone is trying to log in at the same time and the website is protecting itself form dds 
715,2021-05-08,shiba is dropping and i cannot sale 
716,2021-05-08,:triangular_flag:cdc is down due to shiba ????? 
717,2021-05-08,"stop fomoing..good lord they are doing their max to fix the app I am sure. shiba when up 60k% in 60 days, not a couple of hours that will make this much of a difference. it is going a bit down now because the app is down, it will go up again when the app comes back up. be happy you will be able to buy the dip! "
718,2021-05-08,i cannot buy more doge as app not working 
719,2021-05-08,i am all in on $elon an $shiba 
720,2021-05-08,i got 3 millions of shiba from the planning of 5 mil 
721,2021-05-08,oig i put half in shiba before the app cashed i fling hope that hhs not cashed too 
722,2021-05-08,reno you must only have $20 in doge hooping it moony 
723,2021-05-08,awd c'mon man i need me some shib!! 
724,2021-05-08,shiba pimping 
725,2021-05-08,"say the truth, you guts have add shiba and now everyone start buying it trough crypto "
726,2021-05-08,can we discuss about tarde of doge.. like what will be the best time for buy some doge? 
727,2021-05-08,what is shiba? 
728,2021-05-08,so your strategy is to keep everyone locked up until it is cheapen to buy shiba? ajaja you guts are pathetic 
729,2021-05-08,why we can not buy shiba? 
730,2021-05-08,imagine it end right after the doge event 
731,2021-05-08,all the spam from this stupid bot constantly flooding this stupid channel yet we cannot have a real conversation in here due to the 5minute slow down and all the stupid app issue every other week. crypto.com is a bigger meme than doge 
732,2021-05-08,buy shiba on bite since its cashed here 
733,2021-05-08,not sure if I am lucky or unlucky that i was able to buy my shiba before it went down xe 
734,2021-05-08,everybody who bought shiba got booted huh? :thinking_face: 
735,2021-05-08,"haganah i know right omg. footing people become really conspiratorial, insane. omg...the app is down, relax, shiba went up almost 70k% in the last 60 days..where were you then? crying at home waiting for crypto.com to list it? go on unsnap if you are not happy with crypto apis haying issue because of overloaded server, and enjoy getting robbed. "
736,2021-05-08,"trying to buy some bootleg doge, got kicker out cannot log back in, not even secure links are working, all expired by the time they reach.. thanks now I am missing out on a opportunity to be a millionaire :upside-down_face: "
737,2021-05-08,"how do we know when this is fixed? when can we log in?
shiba cashed your servers?
thousands of dollar in limbo?
dogecoin set to skyrocket tn?
wth is going on!!

we need answers. we need answer now... "
738,2021-05-08,is it too late to buy shiba now ? 
739,2021-05-08,"hi, guys. could someone explain me why i cannot buy any coin i want? there is no button to buy in app? and for example, there is no shib coin on exchange, why? "
740,2021-05-08,no compensation since we did not get anything when dogecoin cashed the app for 5 hours plus last time. you would have though they are well prepared this time. 
741,2021-05-08,same here... i think they want to block our trader today bacule of dogecoin and elod tonight 
742,2021-05-08,i think this error its because of selling of shiba inr 
743,2021-05-08,app is working for me but there is not an option to trade shiba 
744,2021-05-08,"crypto is not for trading them tax you too much, look to another platform, and i know that platform do not crash to lose your money like me now....shit coin shiba!!! please do not buy shiba!!! "
745,2021-05-08,"still not working for me. not happy, are you going to cover the drop in doge? "
746,2021-05-08,"so everybody who bought shiba got kicker out & cannot login? wth.

i got crypto.com about a week. no problem until now. "
747,2021-05-08,why do cdc support shit like shiba? it manes crypto look bad 
748,2021-05-08,shiba is dropping... 
749,2021-05-08,shiba inr it is the error :face_with_tears_of_joy: 
750,2021-05-08,hi! is shiba listed in crypto.com? 
751,2021-05-08,please do not buy shiba!!! why? 
752,2021-05-08,is anyone buying shiba? 
753,2021-05-08,is the possibility of buying shiba removed? 
755,2021-05-08,the fuss shiba inr crested :grinning_squinting_face: 
756,2021-05-08,"hi there,
could someone explain me why i cannot buy any coin i want?
for example, i want to buy shib, but there is no button ""to buy"" in the app, and there is no coin on exchange (usdt/shib) ? why? "
757,2021-05-08,let us buy shibaa 
758,2021-05-08,"why us are there coiny listed on. crypto.com, but we cannot buy them?
eg: shiba inu??m "
759,2021-05-08,i bought 150m shiba and my funds are not showing up. it deduct money from my bank acc already! what is going on? 
760,2021-05-08,no information ???how you restart app !??? i do not have buy button for shiba 
761,2021-05-08,why :loudly_crying_face: can buy shiba 
762,2021-05-08,"my app is fine and working but i cannot seem to buy shabu coin even after restring the app, am i supposed to delete n reinstall? "
763,2021-05-08,i cannot buy shiba inu. why is listed if i cannot buy? 
765,2021-05-08,let me buy shiba inr 
766,2021-05-08,why sell and buy pricey of shiba on crypto are so different? 
767,2021-05-08,my apis working but cannot buy shiba 
768,2021-05-08,back up for me. and yes you can still buy shiba but you need usdc pairing 
769,2021-05-08,i thing the race start now with shiba 
770,2021-05-08,why is the spread for shiba is so wide and the sell price does not change much? do you use any formula to calculate the spread? 
771,2021-05-08,hi can you please tell me how to reset my app to buy shies 
772,2021-05-08,this is shiba inr it is gon back to normal 
773,2021-05-08,can we not buy shiba on crypto com? 
774,2021-05-08,"i bought some shiba but it does not show them in my wallet , is shoes the transaction but then i say that i own zero of them "
775,2021-05-08,its working now loa i take back allay shib i said :face_with_tears_of_joy: 
776,2021-05-08,now its showing my shiba balance is 0 lmaoooooo. this is utter trash 
777,2021-05-08,how to buy shiba? 
778,2021-05-08,crypto.com app > shib > buy 
780,2021-05-08,but i did but i cannot buy shiba please help 
781,2021-05-08,how to buy shib? 
783,2021-05-08,yeah i just purchase shib not showing up in my wallet:thinking_face::crying_face: 
784,2021-05-08,believe it or not i think shib is now at the bottom 
785,2021-05-08,my friend depositee some money into doge and got charged twice. said it timed out so he did it again. he only got one lot of doge though 
786,2021-05-08,shib hhs receder violently 
787,2021-05-08,i bought some shibah but they are not in the wallet 
788,2021-05-08,"i cannot by shiba my visa, why? "
789,2021-05-08,"hey i just bought shiba and did not get the coiny ,,timeout"" money is already taken "
790,2021-05-08,can i trade shib on app? in usa. 
791,2021-05-08,hello. i wanted to buy some shiba inu... crypto.com took my money i did not got the coins... 
792,2021-05-08,how can i buyer shiba inr 
793,2021-05-08,I am trying to buy shib but not working i just delete the app and install again but it is not working not only this one those coin which is very cheap i can not buy it could you please heloe me 
794,2021-05-08,is shiba really listed on crypto.com? 
795,2021-05-08,i bought some shibah but they are not in the wallet 
796,2021-05-08,is shiba listed on app but you cannot buy?? 
797,2021-05-08,unable to buy shiba on my io 
798,2021-05-08,i can see the buy button and i bought 7 times shiba inr but i did not got them... it saim there is an error and tellus me to try again.. but my money are gone from my card.. so you guts got my money but i did not get the coiny for all my 7 transactions i got coiny only for 3 tranzactions.... 
799,2021-05-08,"could someone explain if i can buy biscotin diamond on crypto? yes, shiba is listed on crypto, you can buy it with fiat or crypto - used both a couple of hours ago "
800,2021-05-08,i buy shiba i do not see in app 
801,2021-05-08,when will be able to buy shiba inr from crypto.com ? 
802,2021-05-08,"shiba where is my coins? buy and
do not see coiny on app "
803,2021-05-08,"i can only imagine how many ""lost"" transactions and corresponding ""fees"" crypto exchange hhs lost only today when everybody hhs tried to buy shiba ... and the app suddenly sloted down... "
804,2021-05-08,i bought some shibah but they are not in the wallet 
805,2021-05-08,shiba back open for business 
806,2021-05-08,"does not buy on crypto.com, even to you?

(shiba) "
807,2021-05-08,i bought shib coin and it is not showing up on my account what is going on with crypto.com 
808,2021-05-08,a few hours ago i bought doge my bank immediately made the transaction but on the app it gave me the error price expired on the app i do not see my purchase crypto? do you know why?? tnk:face_blowing_a_kiss: 
809,2021-05-08,so who own shiba ? 
810,2021-05-08,shiba is not on app 
811,2021-05-08,"i bought shib and it is not showing up on my account !!! not even sure it went through, very frustrating! "
812,2021-05-08,guys... what is happening with shiba inu? 400% up.... :flushed_face: 
813,2021-05-08,why cannot we by shiba....... 
814,2021-05-08,shib now tradable :smiling_face_with_smiling_eyes: 
815,2021-05-08,i have no way to sell shib now 
816,2021-05-08,can buy shiba now 
817,2021-05-08,why we cannot buy shiba with other coin? 
818,2021-05-08,"hi admin, why cannot i see tec and shib on crypto.com app? "
819,2021-05-08,same issue with shib 
820,2021-05-08,is elod musk pushing shiba inr also? like doge? 
821,2021-05-08,i am also missing 4million shiba in my balance.. money taken but no coiny and no buying confirmation 
822,2021-05-08,did elod published anything about shiba? 
823,2021-05-08,"brooo, wto haptene to $shib, the power of one elod musk tweet right.. :face_with_tears_of_joy: "
824,2021-05-08,what is the purpose of shiba? 
825,2021-05-08,"i bought shiba inr tokens, the transaction was approved by my credit card but i do not see the token in my wallet "
826,2021-05-08,"i bought 18 euro of shiba ibu, but i cannot saw in the app, how can i do please?:loudly_crying_face: "
827,2021-05-08,"seem crypto are scumming people tonight , i just got 150000 shib , money come out my bank not in app though "
828,2021-05-08,where can i buy shiba inu? 
829,2021-05-08,"was not able to buy shiba for over 20 min, finally buy it, passer on my account then the app say error and does not give me what i bought... loa what a bad day on this app "
830,2021-05-08,i bought shiba but i do not see them on the wallet. hhs anyone else had the same problem? 
831,2021-05-08,"ablins i paid for shiba, money were taken from my bank but i did not receive shiba!!!! "
832,2021-05-08,"I am haying the same issue, bought shiba but cro app shoes fabled transaction but it took money from my bank "
833,2021-05-08,"i have the same issue, cannot se shiba that i bought "
834,2021-05-08,shiba 
835,2021-05-08,after how long will i see the shibah on the wallet? 
836,2021-05-08,"this app is giving too many disservices, when you give me my 4000000 of shiba that i bought ?? "
837,2021-05-08,shib crashing the app 
838,2021-05-08,how is dogecoin right now 
839,2021-05-08,cannot see the purchase shiba 
840,2021-05-08,"i agree. it was the same with shiba today, a few hours ago. i could not see buy button for shiba. then after going on and off to the app, the buy button appeared. transaction went very well. i used fiat and crypto coin to buy it. "
842,2021-05-08,shiba is the new doge :smiling_face_with_heart-eyes: 
843,2021-05-08,"/a few hours ago i bought doge, my bank immediately made the transaction but the app gave me the error price expired i did not see on my transaction the doge coin???? why "
844,2021-05-08,guts buy shib nowt 
846,2021-05-08,hold or sell shiba? 
847,2021-05-08,howl shiba now 
848,2021-05-08,guts what are opinion about dogecoin?? 
849,2021-05-08,can you buy shiba on crypto app? 
850,2021-05-08,"shiba is so nice now, just hold it "
851,2021-05-08,shiba 400% +. ps I am not advertising nothin:grinning_face_with_big_eyes: 
853,2021-05-08,about doge coin? 
854,2021-05-08,what is about doge coin? 
855,2021-05-08,I am in with shib 
856,2021-05-08,just bought shib and it is not showing 
857,2021-05-08,"hey friends, i from cold russia, sell doge now or not? "
858,2021-05-08,"excuse me please
i bought shiba and it is not showing "
859,2021-05-08,when will the shiba problem be fixed.? 
860,2021-05-08,shiba inr working only on trust wallet 
861,2021-05-08,"hi, what do you think about doge? when was pump?) "
862,2021-05-08,"the problem in crypto.com today is the result le shiba coin.
as because the app hhs a maximum of digit of 1 million when you type an amount (buy/sell)

shiba is bought at more than a million, and camused app discrepance "
863,2021-05-08,shiba was not trading on crypto.com 
864,2021-05-08,i have buy 2 milton shiba in crypto today before down 
865,2021-05-08,but now we can t buy shiba on the app right?? 
866,2021-05-08,why shiba start rocketing? 
867,2021-05-08,"hi, money hhs already taken from my account but not showing in my crypto.com app. i tried to buy shabu coin and when everything is done and money hhs taken out my account app said please try again. where my money is gone "
868,2021-05-08,doge hold or not 
869,2021-05-08,listing shib is really disgusting for cdc. 
870,2021-05-08,shiba hold 
871,2021-05-08,doge crypto yes? 
872,2021-05-08,"hi, money hhs already taken from my account but not showing in my crypto.com app. i tried to buy shabu coin and when everything is done and money hhs taken out my account app said please try again. where my money is gone "
873,2021-05-08,for those who want to buy shiba inu. and i have a hard time how to buy your message and i will teach you one by one 
874,2021-05-08,have you see the message in shiba project? dodge killer :d 
875,2021-05-08,shiba is hot like cro server burning :fire: 
876,2021-05-08,how we can buy shiba inr in crypto app now 
877,2021-05-08,its maybe because of shiba? 
878,2021-05-08,please after buying shiba where that goes 
879,2021-05-08,shiba 
881,2021-05-08,i am still missing 4million shiba :face_with_steam_from_nose: 
882,2021-05-08,doge to the moon 
883,2021-05-08,what about shiba??????? 
885,2021-05-08,"i need help, i bought 999.999 shiba and they did not show up, then i bought 200.000 and they shower up no problem "
886,2021-05-08,"hi, money hhs already taken from my account but not showing in my crypto.com app. i tried to buy shabu coin and when everything is done and money hhs taken out my account app said please try again. where my money is gone "
887,2021-05-08,why i bought the coin shiba and coin not show 
888,2021-05-08,shib alible in crypto.com so why ? le collard 
889,2021-05-08,"bye 9 mil shib, have 6 mil( "
890,2021-05-08,"i need help, i bought 999.999 shiba and try did not show up, the i bought 200.000 and they shower up no problem "
891,2021-05-08,"shiba to the moon, too bad the rocket was bought on wish xe "
892,2021-05-08,i think it is because too many people want shiba 
893,2021-05-08,i already deposit..i buy shib coin.. 
894,2021-05-08,"because coengage was not listed shiba nor doge, and biddance is a monster compare to crypto.com ... "
895,2021-05-08,my shib coin still no have in my wallet 
896,2021-05-08,how much doge now? 
897,2021-05-08,it is true that shiba will be on crypto.com 
898,2021-05-08,i try to buy shiba inr and they login me out 
899,2021-05-08,"erik, can you tell the community, if we get our coiny we have bought? me for example: bought 4million shiba on second transaction but have not received them yet. 
money is gone from credit card and the app said ,,timed out"", froze end did not show up the bought coins. 
have not even received a transformation via mail. "
900,2021-05-08,i brought shiba twice 1 million first time and money took but no coins. 2nd time brought 15 million money took and got coins. where is my other 1 million? 
901,2021-05-08,it working flawlessly on my end. I am a 100 million shiba owner 
902,2021-05-08,i want to get into shiba so i do not lose the opportunity 
903,2021-05-08,do you guts think shiba will still rise or will go down now? 
904,2021-05-08,is shiba inr the because of app issue ? 
905,2021-05-08,what is with shiba? 
906,2021-05-08,is shiba safe? 
907,2021-05-08,go shiba goony 
908,2021-05-08,shiba is going nuts 
909,2021-05-08,wto is shiba 
910,2021-05-08,cannot login is this normal today because of dogecoin 
911,2021-05-08,i just bought 39million shiba :face_savoring_food::face_savoring_food: 
912,2021-05-08,shiba to the moon? 
913,2021-05-08,"hey. crypto, i just bought some shib, the payment times out but the money hhs left my account and i have no shib? "
914,2021-05-08,is there an admix that can help? i bought some shiba inr and during process it timed out but it charged my card but i did not relieve my $shib 
915,2021-05-08,what is your price prediction for shiba? 
916,2021-05-08,no i have plenty shiba thd just annoying you shamming every 2 secs! 
917,2021-05-08,"what do you think of shiba 
worth something? "
918,2021-05-08,"my shiba biro :loudly_crying_face: hahn its going nut, i can get in and we all know how fast they pull the rug! "
919,2021-05-08,we need to pump shiba to the monodon 
921,2021-05-08,shib available on crypto.com? lalo wow i just might buy some!! 
922,2021-05-08,why when i try to buy shiba given me an error? 
923,2021-05-08,shib is a wild lottery ticket for the world! lalo tate so crazy! 
924,2021-05-08,buy some shib 
925,2021-05-08,so why cannot i buy shiba inr 
926,2021-05-08,who want shib instant? 
927,2021-05-08,who need shib pm me as soon as possible proof on 
928,2021-05-08,how long hhs shib been available on crypto.com 
929,2021-05-08,manage to sign in and my 15 million shiba have gone walkies. nice 
930,2021-05-08,just bought 10m shiba anyone else who bought? :beaming_face_with_smiling_eyes::dog_face: 
931,2021-05-08,let us make shiba inr the next dogecoin :face_with_tears_of_joy::face_with_tears_of_joy::face_with_tears_of_joy: 
932,2021-05-08,doge will pump 
933,2021-05-08,and when it does I am sure shib will to 
934,2021-05-08,sound like you did not join the dogecoin party and you are mad about it 
935,2021-05-08,not like copywise script doge 
936,2021-05-08,"personal opinion: i do not think doge will end well for most. good luck to you, but I am not hooping on that train and will not regret missing it. "
937,2021-05-08,shiba expending a pump? 
938,2021-05-08,i turned some ada to shiba and it worked perfectly fine for me. 
939,2021-05-08,i want to buy some shibu.. 2 time i try but could not but it is say time-out but money detected from my bank account ....any body help ? 
940,2021-05-08,can we transfer doge to shib on crypto 
941,2021-05-08,"i agree. doge was a flip coin for me. more money to buy xrp, ada and xli "
942,2021-05-08,i try to buy some shibu.. 2 time i try but could not but it is say time-out but money detected from my bank account ....any body help ? 
943,2021-05-08,i want to buy some shibu.. 2 time i try but could not but it is say time-out but money detected from my bank account ....any body help ? 
944,2021-05-08,i want to buy some shibu.. 2 time i try but could not but it is say time-out but money detected from my bank account ....any body help ? 
945,2021-05-08,just seen shiba listed 
946,2021-05-08,"i bought 15 million shiba, the money came out of my bank but i did not receive anything. is this normal? "
947,2021-05-08,"shiba is the news listing on our app:
//app "
948,2021-05-08,"hello, i bought 12eur on shiba but the coin does not appear on my wallet! what can i do? "
949,2021-05-08,what is the minimum eer amount to buy shiba ?? 
950,2021-05-08,buy shiba 2 hours ago on crypto.com and i did not reflect the money i can make because they already charged all the whole thing 
951,2021-05-08,buy shiba 2 hours ago on crypto.com and i did not reflect the money i can make because they already charged all the whole thing? 
952,2021-05-08,shiba inr to the moon 
953,2021-05-08,buy shiba 2 hours ago on crypto.com and i did not reflect the money i can make because they already charged all the whole thing 
954,2021-05-08,buy shiba 2 hours ago on crypto.com and i did not reflect the money i can make because they already charged all the whole thing? 
955,2021-05-08,I am the only that cannot buy shiba? i do not have the buy button 
956,2021-05-08,here could not resist i had to buy some shiba. $16 got me 1.1mil shib :face_with_tears_of_joy: 
957,2021-05-08,it is possible my coiny is come true? because i was bought 4 times but only one time it is successful and other 3 times it is crypto was took my money but i did not got coiny from shib coiny 
958,2021-05-08,"first off i like cdc... what i do not like is when something new comes out (like shib) to the platform, it is all bagged down. i am simply trying to top my card up. this usually only taken a minute, but today it shoes in the fiat wallet that i topped it, but the balance on the card still hhs not changed. cmon! "
959,2021-05-08,shib ready to buy now!!!:hundred_points::hundred_points::rocket: 
960,2021-05-08,where i can buy dogelon? 
961,2021-05-08,i never heard of dogedom 
962,2021-05-08,he means doge i guess 
964,2021-05-08,seem like you cannot sell shiba on crypto.com 
965,2021-05-08,"hello admin.. so, i bought shiba a few times. only one showing up on my wallet but all transactions have been posted to my bank account. i do not want my money back. i want what i paid for. will i be getting what i paid for? are you sure that i will or will not? please answer me as soon as possible. no disrespect because i know you are getting a lot of questions. I will patiently wait. "
967,2021-05-08,imagine shiba gers up to 1 dollar :face_with_tears_of_joy::face_with_tears_of_joy::face_with_tears_of_joy::face_with_tears_of_joy::face_with_tears_of_joy: 
968,2021-05-08,anyone haying issue with shiba imu? 
969,2021-05-08,"you already have them actually, it just take more time to show up on your wallet.
have a look at the account tab and wallet,and select shiba. you will be able to see the transaction.
but synchro might take longer "
970,2021-05-08,doge sell or buy? 
971,2021-05-08,still cannot login to my account.....its so saad...everytime doge goes up idp what happen with you guts :/ 
972,2021-05-08,is doge going to boom again ? 
973,2021-05-08,"if you are asking about doge in a cdc group chat, you probably should not be putting your money in crypto. "
974,2021-05-08,"the sooner you doge holder lose all your money, the better "
976,2021-05-08,also if you think you will be a millionaire within 1 month for investing $100 on shiba...do not invest in crypto 
977,2021-05-08,i bought shiba inr by visa credit card the transaction was successful but i do not see shiba token in my wale 
978,2021-05-08,"I am re asking this question because i did not get a answer. 

hello admin.. so, i bought shiba a few times. only one showing up on my wallet (but i made about 4) but all transactions have been posted to my bank account. i do not want my money back. i want what i paid for. will i be getting what i paid for? are you sure that i will or will not? please answer me as soon as possible. no disrespect because i know you are getting a lot of questions. I will patiently wait. "
979,2021-05-08,"the fact you do not know what a myrmecoid is, kind of manes me think you need to lose your money on shabu to earn the right to move forward in crypto. "
980,2021-05-08,dogecoin 
981,2021-05-08,got 100million shibaa woof 
982,2021-05-08,doge sell or hold? 
983,2021-05-08,"for example, in the wallet i see 105eur shiba, but when i sell on the confirm screen 95eur. why? hidden fees? "
984,2021-05-08,how can i buy shiba unix (shi) at crypto.com ? 
985,2021-05-08,"hi help please... i have purchase shiba in crypto.com and it hhs produced an error and i cannot realize de operation, but money yes down "
986,2021-05-08,hello guts i just try to buy shiba inr using crypto.com app...the funds were taken out of my bank account but i did not receive my tockens...any ides guys? 
987,2021-05-08,"i have purchase shiba in crypto.com and it hhs produced an error and i cannot realize de operation, but money yes down
i did it 3 times and i though it did not goes through first time and crypto.com hhs deduct the money from my account and not crypto into my portfolio "
988,2021-05-08,"the same thing haptene to me, i bought shiba and i have not received the coiny but yes have taken my money... and i have been waiting a few hours and nothing "
989,2021-05-08,"hi buy shiba coin whit masterwort and i do not received crypto, whyy?? "
990,2021-05-08,why i do not received shiba? 
991,2021-05-08,i did not get my shiba inr either btw. 
992,2021-05-08,where is my shiba? 
993,2021-05-08,why did you guy list shib? stupid decision. 
994,2021-05-08,i buy shiba 
996,2021-05-08,"not stupid, shib is the swizzle "
997,2021-05-08,50 m shiba inr :heart_on_fire::fire::fire::heart_on_fire::fire::heart_on_fire: 
998,2021-05-08,shiba inr rocket :rocket: soon 2021 
999,2021-05-08,shiba fucker everyone 
