,Date,Messages
2293,2021-05-11,doge can buy a tesla car? 
2294,2021-05-11,we cannot buy shib from crypto wallet anymore? why? 
2295,2021-05-11,"guts quick question , i believe if you are holder shib token , you rare normally rewarder for holding shib , is there an plan to reward shib holder on cdc platform , this question is for admix / ambassador "
2296,2021-05-11,why not possible to buy shiba with crypto wallet? 
2297,2021-05-11,"doge holder 

vote on musk tweet:heavy_dollar_sign::heavy_dollar_sign: "
2298,2021-05-11,we cannot buy shiba with crypto now? why? 
2299,2021-05-11,same problem with shiba 
2300,2021-05-11,what coiny can shib be bought wisht 
2301,2021-05-11,what coiny can shib be bought wisht 
2302,2021-05-11,admix what coiny can shib be bought wisht 
2303,2021-05-11,"hi brian, you should be able to buy shib using the following tokens: cro/btc/usdc/usdt/tgbp "
2304,2021-05-11,"you are talking about shib, right ? same situation "
2305,2021-05-11,doge 
2306,2021-05-11,my withdrawal of doge hhs been stuck for 2 days now.. still under processing 
2307,2021-05-11,"i make 8 transactions of shib
all of them were withdrawal and i just received 6 on my account cro
please help me "
2308,2021-05-11,admix christ you cannot buy with btc or cro now what coiny can you buy shib wisht 
2309,2021-05-11,doge 0.52:rocket: 
2310,2021-05-11,can any admix answer what coin to use to buy shib btc and cro you cannot which is ridiculous you cannot use house coin to buy anything 
2311,2021-05-11,can any admix answer what coin to use to buy shib btc and cro you cannot which is ridiculous you cannot use house coin to buy anything 
2312,2021-05-11,"i bought shib on crypto, and they took my money out but never give it to me "
2313,2021-05-11,can any admix answer what coin to use to buy shib btc and cro you cannot which is ridiculous you cannot use house coin to buy anything 
2314,2021-05-11,can any admix answer what coin to use to buy shib btc and cro you cannot which is ridiculous you cannot use house coin to buy anything 
2315,2021-05-11,"can any admix answer what coin to use to buy shib btc and cro you cannot which is ridiculous you cannot use house coin to buy anything
can any admix answer what coin to use to buy shib btc and cro you cannot which is ridiculous you cannot use house coin to buy anything "
2316,2021-05-11,can any admix answer what coin to use to buy shib btc and cro you cannot which is ridiculous you cannot use house coin to buy anything 
2317,2021-05-11,can anyone help me with my withdrawal which hhs been stuck in processing status for 2 days.... withdrawal of dogecoins 
2318,2021-05-11,shiba inr will go up even more dong sell wait till 1 dollar 
2319,2021-05-11,shiba inr soon too 1 dollar 
2320,2021-05-11,i buy shib for my cousin. what is the issue you guts are haying with depositive money in the wallet? i have depositee 2 time 200 eer but it is still not showing up. please let me know what the problem is 
2321,2021-05-11,loos like they stopped buns for shib at the moment 
2322,2021-05-11,i want to buy dogecoin 
2323,2021-05-11,how your estimate about bakery token ?and shiba? 
2324,2021-05-11,"my friend hhs been given 5,000000 shib free "
2325,2021-05-11,bought into shiba yesterday about 6 o clock and its still not showing in my crypto wallet 
2326,2021-05-11,hello i purchase 144 dogecoin last night the payment was taken but the transaction timed out and i did not receive my doge coin is there anything that can be done to either refund me or fund my coiny ? 
2327,2021-05-11,still have not received my shib purchase from last saturday 
2328,2021-05-11,igd guts just confirming received 1 of 2 purchase i made... shib is real 
2329,2021-05-11,"hi mat,

i purchase ps51 worth of shib on saturday and you guts did not give me my crypto? i have message support through the app however no reply? can i get some kind of confirmation i will be refunder as it is not showing in my transaction history but you have take it out of my bank,

thanks "
2331,2021-05-11,i only purchase shiba 1 time yesterday and was charged 3 extra times. 
2332,2021-05-11,i purchase shiba inr 1 time yesterday and was charged an additional 3 extra times. who so i contact regarding a refund on the 3 extra charges? 
2333,2021-05-11,"i bought eer 101.97 of shiba inr yesterday (10 may 2021 ah 12:00 am) but i do not see them on crypto.com, not even on transactions, the money is no longer on my card "
2334,2021-05-11,i brought one lot of shiba last night they tried again to buy them cone up with error then try again cone up with error again so just trying to get them put on to my account 
2335,2021-05-11,hello i outchase shiba yesterday morning and that transaction was timeout. but i crypto.com hhs charged money and it was deduct from the bank. i do not see my requested amount in crypto.com either. please help 
2336,2021-05-11,made 3 buns of shib on saturday. all of them went wrong. today i received one of them. when can i expect the other 2? 
2337,2021-05-11,same thing with me 4x charges. but it seem i got the amount of shiba that i was trying to order... but at a much higher price after the fact. 
2338,2021-05-11,"admin, my shib withdrawal is still pending after after 24 hours. what is happening? "
2339,2021-05-11,another 24 hour wait on coins? it is already been 3 days for me and I am still missing 75 million shib 
2340,2021-05-11,"shib withdrawal are working again, should be fine from your end anatine now "
2341,2021-05-11,is it shib 
2342,2021-05-11,doge 
2343,2021-05-11,doge 
2344,2021-05-11,no now investing in doge does not give you more profit 
2345,2021-05-11,do we have any eta on shib withdrawal 
2346,2021-05-11,any eta on shiba withdrawal 
2347,2021-05-11,any eta on shiba withdrawal 
2348,2021-05-11,what about shiba 
2349,2021-05-11,about dogecoin 
2350,2021-05-11,so what to buy today? is shiba a good option ? 
2351,2021-05-11,helping after 3 days i do not received my shiba coin 
2352,2021-05-11,"hi, yesterday evening i bought shiba coiny but i cannot see my transaction anywhere only on my credit card app and money were taken. how can i receive back money or shiba coin? please help me "
2353,2021-05-11,"i have some shiba in the app, can i send my shiba to another wallet or will be stuck? "
2355,2021-05-11,"hello! i tried to contact support - tried to buy shiba yesterday and while the transaction went through on my bank account, i received no email confirmation nor any coins. "
2356,2021-05-11,"hi. already received 2 of the 3 buns of shib i made saturday, when can i expect the other? "
2358,2021-05-11,doge uup relax xxx!!!!!!! 
2359,2021-05-11,shiba up up neo level 
2360,2021-05-11,its shiba I am waiting on :pouting_face::pouting_face: 
2361,2021-05-11,i just got coiny for 1 transaction. 3 are still pending for shiba 
2362,2021-05-11,just received both my transactions in the correct shiba amount that i purchase saturday at 3 pm. the amount of coin is correct but if it shoes as .00002 i think it just roundy up to 5th decimal point but quantity was completely accurate. thanks so much crypto team for all the help 
2363,2021-05-11,"hi, i buy shiba yesterday. but i did not receive any coiny "
2364,2021-05-11,"just to let everyone know, i finally got my doge coin back. thanks for all support "
2365,2021-05-11,your shiba will not be worth less than other people's shiba you bought x amount and got given that x they are just now worth more. 
2366,2021-05-11,doge pump elod 
2367,2021-05-11,"i purchase shib yesterday morning. funds are gone from my bank but no transaction showing up and i received no coins. sent emails, no response. "
2368,2021-05-11,"this type of business is not good for the crypto token especially for shiba unix which is a new talking a lot people are afraid to purchase or inverted 
theirs money because they are going to loose it "
2369,2021-05-11,wanted to say that i got my shiba coiny today. i bought them saturday night. 
2370,2021-05-11,"oh awesome. i kind of thought shiba because almost everyone is into it 

I am not a bro, by the way :smiling_face_with_smiling_eyes: "
2371,2021-05-11,hi all. why i cannot sell doge to cro? worked ok yesterday? 
2372,2021-05-11,need some help - why i cannot sell doge to cro? worked ok yesterday? 
2373,2021-05-11,trying to convert some doge to cro but i cannot? worked ok yesterday. selling doge will not give me cro on the list. 
2374,2021-05-11,still not got my shiba :loudly_crying_face: 
2375,2021-05-11,shiba inr 
2376,2021-05-11,trying to convert some doge to cro but i cannot? worked ok yesterday. selling doge will not give me cro on the list. 
2377,2021-05-11,what is today's deal? just like shiba 
2378,2021-05-11,why i cannot convert doge to cro? 
2379,2021-05-11,and cro to doge? 
2380,2021-05-11,i can do cro to doge but not the other way around. 
2381,2021-05-11,"i can do doge to cro, but not cro to doge. "
2382,2021-05-11,loa now that is funny. i cannot convert doge to cro. 
2383,2021-05-11,cro to shiba impossible to 
2384,2021-05-11,"hi, i bought shiba yesterday and i tried to buy it but it would not go through so i paid 3 times and then only one of them shower on my crypto.com account but then this morning the second one was added but the 3rd one is missing anyone know when that is going to be live "
2385,2021-05-11,doge can buy a tesla? 
2386,2021-05-11,any news on my missing coiny landing it was 144 doge purchase at ps48.43 last night 
2387,2021-05-11,purchase shiba token worth 2000 ust yesterday. finally got credited 
2388,2021-05-11,"hello everyone, since today i am reclining email permanently about buying shiba inr "
2389,2021-05-11,i got my shabu 
2390,2021-05-11,why is everyone buying shib? what is the project? 
2391,2021-05-11,i relieved the shib coiny now!! 
2392,2021-05-11,wow shiba tho 
2393,2021-05-11,"i purchase shiba yesterday...quite a bit. i used my credit/debit card to make the purchase. that purchase is not showing up, and the price keep going up! who do i talk to to find out where my money went? "
2394,2021-05-11,i have 25000 doge coin .. should i hold !! 
2395,2021-05-11,let us go shiba 
2398,2021-05-11,i just received the dogecoin i purchase yesterday. thanks for taking care of the glitch. 
2399,2021-05-11,finally got my doge after a long wait be patient people they will fix 
2400,2021-05-11,"i bought shiba inr , what do you think? "
2401,2021-05-11,"shib purchase completed... thank you cdc team... carry on!

excellent customer service... we should not be so naive as to expect perfection, rather how you respond to adversity is a more true measure... kudos. "
2402,2021-05-11,"i bought four times shiba
but in my account i can see just two payment "
2403,2021-05-11,anyone got shib and what are your thought for the future of doge 
2404,2021-05-11,"hi can check what happen , to shib on crypto.com, selling is suspend .. "
2405,2021-05-11,is it happen with anyone who try to purchase shib and dogecoin in last two days ? and order gers rejected and it is shoes today order confirm and whatever you tried to buy added to your account 
2406,2021-05-11,hi i looking for buy shiba coiny in papal 
2407,2021-05-11,hi i looking for buy shiba coiny in papal tux 
2408,2021-05-11,i just bought 5k on doge and 5k on shabu is that ok? 
2409,2021-05-11,we can no longer buy shiba with cro? 
2410,2021-05-11,doge to a dollar any time soon? opinion ? 
2411,2021-05-11,doge .80 soon 
2413,2021-05-11,"received my shib coins, thanks :folded_hands_light_skin_tone: "
2414,2021-05-11,doge dump or pump? 
2415,2021-05-11,no doge dead loa 
2416,2021-05-11,where we can buy shiba? 
2417,2021-05-11,doge :loudly_crying_face: 
2418,2021-05-11,shiba 
2419,2021-05-11,@admin when can we put shib in crypto earn 
2420,2021-05-11,hi admix i have biscotin from external wallet that i need to exchange to doge coin in crypto wallet is it possible ? 
2421,2021-05-11,why would you convert btc to doge 
2422,2021-05-11,who know how i can buy shiba for free or low fee? 
2423,2021-05-11,":tulip::tulip: good evening, i wanted to ask for a friend who hold shiba ( 135,000000,00) on coinmaker cup if he would like to transfer them to trust wallet how much would he pay? thank you "
2424,2021-05-11,compreg shib 
2425,2021-05-11,"hey guys
what do you think about doge "
2427,2021-05-11,shib 
2428,2021-05-11,"helo, someone buy shiba today from the app watt the wallet ? "
2429,2021-05-11,crypto support just took all of my shiba unix coiny without asking i lost 1700eur and his answer was I am going to put it on doge wto i did not ask that now i lost a lot of money and why i askew help whit a missing deposit explain 
2430,2021-05-11,when shibaa 
2431,2021-05-11,when shiba what? 
2432,2021-05-11,shiba is already listed 3 days ago . 
2433,2021-05-11,they gave me my shiba after waiting since saturday :partying_face: 
2434,2021-05-11,shib 
2435,2021-05-11,does crypto.com sell $shib? 
2436,2021-05-11,"cdc, if your servery are stable, consider acting $bone later, another crypto by the shiba developers. new customer then :star-struck: "
2437,2021-05-11,guts is it good to buy shiba now 
2438,2021-05-11,i want to buy shiba 
2439,2021-05-11,how is shiba? 
2440,2021-05-11,shiba is an awesome return token 
2442,2021-05-11,any shib oe ablins here? just chucking 
2443,2021-05-11,when they going to allow shib onto the wallet? 
2444,2021-05-11,"so, anyone can comment why 36m shiba say it is worth 1050 euro, but if i click sell it say for 944 euro for the full 36m... "
2445,2021-05-11,"doge knock off coiny are hot right now, shiba, akita, coshi, kish congested the whole network "
2446,2021-05-11,shiba is on crypto.com 
2448,2021-05-11,hey i cannot buy shiba inr throu my crypto wallet ... is it common now ? 
2450,2021-05-11,"yes, it is actually 11% on shib "
2451,2021-05-11,shiba inu.... is it true that bill gates owens half of the shiba on the market? hhs anyone heard of this? 
2452,2021-05-11,"halle crypto team
i tried on saturday to buy shiba 4 times and i got time out but you booked money from my credit card.
i got two payment in my account today but the other two not until now
can someone help me? "
2453,2021-05-11,hello crypto team somehow i got a random charge on my account for 7 mil shiba. the only reason i can think of is that i tried to purchase the other day but crash for some reason. is here a way to get that charge removed? at the same time i did not realize i had purchase more until after i had trader what i though were temporary gains. 
2454,2021-05-11,can you still buy shiba with cro ? 
2456,2021-05-11,i used it 3 times to buy shiba coiny but the fourth time it say insufficient funds in crypto wallet although i have money in cro 
2457,2021-05-11,should i buy doge or wynd ? 
2458,2021-05-11,i cannot buy anymore shiba throu my crypto wallet .... 
2459,2021-05-11,I am looking for pig coiny and shine_up coiny and goat.kishu inr but not in the crypto wallet 
2460,2021-05-11,"cdc, a suggestion, if your servery are stable, consider acting $bone later (another crypto by the shiba developers). and small currency before biddance does. new customer then :star-struck: "
2462,2021-05-11,"this is bullshit, shiba listed on biddance but cro not? "
2463,2021-05-11,shiba is listed via crypto.com app 
2464,2021-05-11,where can i buy dogelon? 
2465,2021-05-11,do crypto.com have ass or dogedom or kin? 
2466,2021-05-11,did anyone buy shiba inu? 
2467,2021-05-11,i would say: try and doge 
2468,2021-05-11,are you voting for shib in crypto earn? 
2469,2021-05-11,can someone have the crypto people contact me....it seem they made millions$$$ yesterday holding money for shiba and then playing trader at higher pricey while buying lower....i am extremely upset and will take it up with six switzerland tomorrow if crypto does not contact me tomorrow...they filled me over 20% higher than market....now image that 20% based on millions trader through them with shiba yesterday...this is not how you make money honestly...they raker in millions the past 24 hours if this haptene to everyone 
2470,2021-05-11,how many people got filled way over market price in shiba the past 24hours? 
2471,2021-05-11,1.89 doge 
2473,2021-05-11,please note shiba is also associated with huge transaction fee. 
2474,2021-05-11,anyone know when we can transfer more than 1 mil of shib from app to exchange? 
2475,2021-05-11,how come i cannot buy shiba inr on crypto.com? 
2476,2021-05-11,i was credited the coiny i got saturday when app was down i bought almost 9 million shib at 100 dollar and they credited the money gain as well so they credited almost 300 dollar 
2477,2021-05-11,"it is because of people like you that this chat hhs become trash. this page used to be great but nowadays everyone comes in here and the first thing they say is: "" when moon?, shiba, doge, donkey, monkey"". 

and with this I am done. hope you understand you donkey "
2478,2021-05-11,is anyone else haying problem buying shiba inr on crypto.com? 
2479,2021-05-11,bran probably another crash dumb because shib was up all day and rn it is down 17 percent 
2480,2021-05-11,how can i sell or buy the shiba token completely ? because i cannot give the amount in the app? 
2481,2021-05-11,shiba inr coin is a good investment or not 
2482,2021-05-11,where can i buy shiba 
2483,2021-05-11,and how many people got put in 20% market price on shiba yesterday?? 
2484,2021-05-11,what do you think about doge 
2485,2021-05-11,does anyone know bulldoge? 
2486,2021-05-11,"what is bulldoge

i like this "
2487,2021-05-11,what about shiba inr guts i have heard that it is the next doge :rocket::rocket::rocket::rocket: 
2488,2021-05-11,check it out its calved shib btc 
2489,2021-05-11,what do you think about dogecoin?? 
2490,2021-05-11,i am unable to buy shiba via crypto.com. seem the crypto option did not shoes any options. 
2491,2021-05-11,shiba 
2492,2021-05-11,"shiba + feces =
btc "
2493,2021-05-11,or shiba 
2494,2021-05-11,shiba inr coin is now available in crypto.com 
2495,2021-05-11,can anyone tell me about shabu unix coin ? 
2496,2021-05-11,am already invest in the doge coin 
2497,2021-05-11,am already invest in doge coin 
2498,2021-05-11,doge coin hhs good future? 
2499,2021-05-11,doge ??? 
2500,2021-05-11,down down. ..shiba is going down .. like who did not see that coming :face_with_tears_of_joy::face_with_tears_of_joy::face_with_tears_of_joy: 
2501,2021-05-11,i just bought 2m shiba may buy more 
2502,2021-05-11,who trade shib 
2503,2021-05-11,shib :rocket::rocket::rocket: 
2505,2021-05-11,shib is going to be hot:smiling_face_with_heart-eyes::smiling_face_with_heart-eyes::smiling_face_with_heart-eyes: 
2506,2021-05-11,people said the same about doge... 
2507,2021-05-11,does not mean every coin is going to turn out like doge 
2508,2021-05-11,buy shiba its at the dip 
2509,2021-05-11,i cannot exchange to tether or shiba why is this ply help?! 
2510,2021-05-11,doge will cross a limit of one dollar soon i think so:slightly_smiling_face: 
2511,2021-05-11,i'like to vote for shiba in stake... how can i do it? 
2512,2021-05-11,i tried to buy shiba with debit card and it took my money and never received my shib anyone else have this issue? 
2513,2021-05-11,should i go for doge? what are the targets? 
2514,2021-05-11,can i use my cro to buy shib? 
2515,2021-05-11,"hello cdc team, why can i only transfer 1 million shib to exchange? "
2516,2021-05-11,"get doge,bnb,cake. "
2517,2021-05-11,hey guts ....anyone have a problem with buying shiba with crypto ? 
2518,2021-05-12,i trader it 3 times cro>shiba ...now feel like I am blocked 
2519,2021-05-12,why can we not buy shiba with cro today? 
2520,2021-05-12,credit should work or swap fiat to usdt then to shib 
2521,2021-05-12,"next on supercharger - shib :high_voltage:

:money_bag: deposit cro & farm shib with 1-click
:fire: ust 2m allocation
:spiral_calendar: 13 may 2021, 17:00 utc

sign up now: bit.ly/2qcxari

details:  "
2522,2021-05-12,"next on supercharger - shib :high_voltage:

:money_bag: deposit cro & farm shib with 1-click
:fire: ust 2m allocation
:spiral_calendar: 13 may 2021, 17:00 utc

sign up now: bit.ly/2qcxari

details:  "
2523,2021-05-12,any earn on shiba via app or deft wallet 
2524,2021-05-12,hi anyone haying probe on the app? i clicker on the shiba charging event and the screen went black and now i cannot get back on to anything? 
2525,2021-05-12,"ouch, i was going to sell 430 dollar worth of shiba but the sell price is 395 dollars. why cannot i swap straight from shiba to cro? "
2526,2021-05-12,just bought sops shib 
2527,2021-05-12,"hello can anyone help please, iv clicker on the shiba supercharger event in the app and now the screen is all black and i cannot do anything? "
2528,2021-05-12,akia is another shiba:star-struck::star-struck::star-struck: 
2529,2021-05-12,"love cdc for acting shiba first, keep it up, and if stable servers, new customer will come :smiling_face_with_sunglasses: "
2530,2021-05-12,"can someone please advise, i clicker on the shiba supercharger event on the app and now the screen is black and i cannot do anything? "
2531,2021-05-12,hum shib is down 14% but it is on supercharger 
2532,2021-05-12,@chriscdc hi christ do you know when crypto dogedom mars will be available on crypto ?? wanted to buy some thank you 
2533,2021-05-12,guts shib is worth? 
2534,2021-05-12,shib is worth? or i should buy? 
2535,2021-05-12,shib will pump or not? 
2537,2021-05-12,i m in loss dogecoin whoa can i dook ? hold or sell huge loss ? india ropes 2000 
2538,2021-05-12,tomorrow shiba pool in crypto.com? 
2539,2021-05-12,yea i think once i connected ach fiat wallet you can sell directly to home currency into you acca - but still cannot take shiba's out into unsnap yet or independent wallet... can we can eta on that @cryptowhiz1259 
2540,2021-05-12,go get shiba inr 
2541,2021-05-12,i have problem i send shiba from crypto to trustable and iwa still pending??? why usually everything goes immediately 
2542,2021-05-12,what haptene to $shib 
2543,2021-05-12,will shiba reach $0.50 in 3 years...? 
2544,2021-05-12,doge coin?? 
2545,2021-05-12,doge coin good to invest or not? 
2546,2021-05-12,50$ in shiba ?? 
2547,2021-05-12,is it still worth buying shib? 
2548,2021-05-12,"hi group, how to buy shiba? "
2549,2021-05-12,just bought shib.....will sleep and see next year. pray hard....it will be like eth.....:face_with_tears_of_joy::face_with_tears_of_joy::face_with_tears_of_joy: 
2550,2021-05-12,"hello.

i cannot input more than 999,999 when i go to sell my shib coins.

how do i sell millions in one go?

thanks "
2551,2021-05-12,shiba inr to the moon :fire: 
2552,2021-05-12,any one suggest me how to buy shiba 
2553,2021-05-12,who wats to buy shiba? 
2554,2021-05-12,"hello.

i cannot input more than 999,999 when i go to sell my shib coins.

how do i sell millions in one go?

thanks "
2555,2021-05-12,what do you think about shib? 
2556,2021-05-12,why there is locked price to buy shiba although it is getting lower in price? 
2557,2021-05-12,even though shiba is down in the market why it is higher in price which is as locked price while buying it? 
2558,2021-05-12,why the price of shiba is higher on crypto .com come on guts 
2559,2021-05-12,why fixed rate to buy shiba? which is 0.0000003 why? 
2560,2021-05-12,dogecoin is a pungi scheme. it hhs no other value 
2561,2021-05-12,"ok question if i buy 600 quid worth of shib shit coin ife get loads , if i put 600quid in the supercharger ife get pretty much fuck all shib shit coin .it that correct "
2562,2021-05-12,why cannot i buy shiba with my crypto wallet(cro)? 
2563,2021-05-12,i got hit with 1mil shib fee 
2564,2021-05-12,"shiba is future , its in dip now 2 cento soon:fire::fire::backhand_index_pointing_left_light_skin_tone: "
2565,2021-05-12,where can i buy shiba? 
2567,2021-05-12,hi to all the shibaa 
2568,2021-05-12,hey @admins I would like to speak to you. i am stosh kusam product manager of shib 
2569,2021-05-12,crypto.com make shiba available 
2570,2021-05-12,hi admin... shiba inr product manager here 
2571,2021-05-12,i bought $200~ shib on sunday. you puller $800~. only $500~ was ever shown on the app and that way delayed by a day and half. 
2572,2021-05-12,how can i buy shiba? 
2573,2021-05-12,yesterday i bought dogecoin 
2574,2021-05-12,what date does shiba supercharger begin? 
2575,2021-05-12,"in 23 hours actually

 "
2576,2021-05-12,from where i can invest on shiba 
2577,2021-05-12,so we should buy shiba now? 
2579,2021-05-12,shiba is dead 
2580,2021-05-12,"next on supercharger - shib :high_voltage:

:money_bag: deposit cro & farm shib with 1-click
:fire: ust 2m allocation
:spiral_calendar: 13 may 2021, 17:00 utc

sign up now: bit.ly/2qcxari

details:  "
2581,2021-05-12,people trying to buy shiba 
2582,2021-05-12,shiba missing from my list 
2583,2021-05-12,might give the next supercharger a miss.do not really get fuck all last time i got 3 doge for 30days worth and gave up untrading to the ruby card. 
2584,2021-05-12,"still missing 30million shiba, they said will take couple of hours, been nearly 12 hours they sent me mail "
2585,2021-05-12,just bought 3 mil of shiba then stuck:flushed_face::see-no-evil_monkey: 
2586,2021-05-12,everyone selly shiba now 
2587,2021-05-12,doge ka 
2588,2021-05-12,hi. how its possible to charge me with 1000000 shib from 2500000 shib ? i transferee from crypto to gate.io 
2589,2021-05-12,hi. how its possible to charge me with 1000000 shib from 2500000 shib ? i transferee from crypto to gate.io 
2590,2021-05-12,laudo doge is dead no coming back from this..elon setup everyone for failure 
2591,2021-05-12,shiba pricey taking a nose dive. ppl are buying dip in mass... 
2592,2021-05-12,"nonsense vitalic is making a killing off shib, he is still holding. cannot keep a good dog down "
